{
  "schema_version": "stack-lock.v1",
  "lock_id": "foundation.v0_2",
  "repositories": {
    "infra": {
      "url": "https://github.com/mmkolpakov/droning-simulation-infra",
      "ref": "foundation-ready-v0.2",
      "commit": "ef88d85d8d483679fe18b80011b2fbb8f950f217"
    },
    "contracts": {
      "url": "https://github.com/mmkolpakov/robotics-runtime-contracts",
      "ref": "foundation-ready-v0.2",
      "commit": "7604901abad92c1b20430e1e68c4c935518c9351"
    },
    "harness": {
      "url": "https://github.com/mmkolpakov/robotics-simulation-harness",
      "ref": "foundation-ready-v0.2",
      "commit": "71e19c03e3e565b6216fe8718cfd12cefb82e43c"
    }
  },
  "images": {
    "simulation": {
      "ref": "robotics/ros-jazzy-simulation:2026-07-05",
      "digest": "sha256:e7a30ca835e0419b929658b4d540aa1ec347b28a65bf1e9357f7d46793fa07ac"
    },
    "ros_base": {
      "ref": "osrf/ros:jazzy-simulation",
      "digest": "sha256:acb7c427deb2aaa5acd0fdfa5f6cca9ad2055a64102b4667986b70d550dc469d"
    }
  }
}
